<?xml version="1.0" encoding="UTF-8" ?>
<xs:schema xmlns:xs="http://www.w3.org/2001/XMLSchema"
>

    <xs:simpleType name="groupRestriction">
        <xs:restriction base="xs:string">
            <xs:enumeration value="ANTIBIOTICS"/>
            <xs:enumeration value="PAIN_RELIEVERS"/>
            <xs:enumeration value="VITAMINS"/>
        </xs:restriction>
    </xs:simpleType>

    <xs:simpleType name="versionRestriction">
        <xs:restriction base="xs:string">
            <xs:enumeration value="TABLETS"/>
            <xs:enumeration value="CAPSULES"/>
            <xs:enumeration value="POWDER"/>
            <xs:enumeration value="DROPS"/>
        </xs:restriction>
    </xs:simpleType>


    <xs:simpleType name="countRestriction">
        <xs:restriction base="xs:integer">
            <xs:minInclusive value="1"/>

        </xs:restriction>
    </xs:simpleType>

    <xs:simpleType name="priceRestriction">
        <xs:restriction base="xs:float">
            <xs:minInclusive value="0.0"/>
        </xs:restriction>
    </xs:simpleType>

    <xs:element name="medicines">
        <xs:complexType>
            <xs:sequence>
                <xs:element name="medicine" maxOccurs="unbounded">
                    <xs:complexType>
                        <xs:sequence>
                            <xs:element name="name" type="xs:string"/>

                            <xs:element name="group">
                                <xs:complexType>
                                    <xs:simpleContent>
                                        <xs:extension base="groupRestriction"/>
                                    </xs:simpleContent>
                                </xs:complexType>
                            </xs:element>

                            <xs:element name="pharm" type="xs:string"/>

                            <xs:element name="certificate">
                                <xs:complexType>
                                    <xs:sequence>
                                        <xs:element name="id" type="xs:int"/>
                                        <xs:element name="organization" type="xs:string"/>
                                        <xs:element name="date" type="xs:string"/>
                                    </xs:sequence>
                                </xs:complexType>
                            </xs:element>

                            <xs:element name="package">
                                <xs:complexType>
                                    <xs:sequence>
                                        <xs:element name="price">
                                            <xs:complexType>
                                                <xs:simpleContent>
                                                    <xs:extension base="priceRestriction"/>
                                                </xs:simpleContent>
                                            </xs:complexType>
                                        </xs:element>

                                        <xs:element name="packageType" type="xs:string"/>


                                        <xs:element name="count">
                                            <xs:complexType>
                                                <xs:simpleContent>
                                                    <xs:extension base="countRestriction"/>
                                                </xs:simpleContent>
                                            </xs:complexType>
                                        </xs:element>
                                    </xs:sequence>
                                </xs:complexType>
                            </xs:element>

                            <xs:element name="version">
                                <xs:complexType>
                                    <xs:simpleContent>
                                        <xs:extension base="versionRestriction"/>
                                    </xs:simpleContent>
                                </xs:complexType>
                            </xs:element>
                        </xs:sequence>
                        <xs:attribute name="id" type="xs:string"/>
                    </xs:complexType>
                </xs:element>
            </xs:sequence>
        </xs:complexType>
    </xs:element>
</xs:schema>
